publishedAt,title
2024-04-25 03:05:32+00:00,Nvidia's Moat Remains Unchallenged Despite Emerging Players' Advanced AI Chips
2024-04-25 00:30:00+00:00,Missed Out on Nvidia? My Best AI Stock to Buy and Hold
2024-04-24 00:15:00+00:00,Why Nvidia Stock Fell 10% Last Week
2024-04-24 00:00:11+00:00,Nvidia Stock: No Reason For An AI Panic (NASDAQ:NVDA)
2024-04-22 17:11:23+00:00,Nvidia: Significant Downside Risks As Its Customers Develop AI Chips
2024-04-11 22:31:30+00:00,"Nvidia Stock Trades At 13% Discount To Long-Term Average, Other AI Stocks At 52% Premium"
2024-04-11 19:45:00+00:00,Nvidia Stock Is Falling Into a 'Correction.' Time to Buy the Dip?
2024-04-10 11:04:56+00:00,"Nvidia (NVDA) stock down 10% from highs, in correction territory"
2024-04-10 09:53:11+00:00,Artificial increase? AI darling Nvidia enters correction territory
2024-04-07 01:00:00+00:00,The NVDA Alternatives: 3 Stocks Offering Superior Growth Prospects to Nvidia
